{
  "schema_version": 1,
  "provider_id": "xai",
  "access_profile": "oauth",
  "source": "curated",
  "observed_at": null,
  "completeness": "partial",
  "models": [
    {
      "id": "grok-4.6",
      "name": "Grok 4.6",
      "description": "Latest flagship Grok model"
    },
    {
      "id": "grok-4.6-latest",
      "name": "Grok 4.6 (Latest)",
      "description": "Rolling alias for Grok 4.6"
    },
    {
      "id": "grok-4.5",
      "name": "Grok 4.5",
      "description": "Previous flagship Grok model"
    },
    {
      "id": "grok-4.5-latest",
      "name": "Grok 4.5 (Latest)",
      "description": "Rolling alias for Grok 4.5"
    },
    {
      "id": "grok-build-latest",
      "name": "Grok Build (Latest)",
      "description": "Rolling Grok Build alias backed by Grok 4.5"
    },
    {
      "id": "grok-build-0.1",
      "name": "Grok Build",
      "description": null
    },
    {
      "id": "grok-4.3",
      "name": "Grok 4.3",
      "description": "Previous flagship Grok model"
    },
    {
      "id": "grok-4.20-0309-reasoning",
      "name": "Grok 4.20 (Reasoning)",
      "description": "Grok 4.20 reasoning model"
    },
    {
      "id": "grok-4.20-0309-non-reasoning",
      "name": "Grok 4.20 (Non-Reasoning)",
      "description": "Grok 4.20 non-reasoning model"
    },
    {
      "id": "grok-4.20-multi-agent-0309",
      "name": "Grok 4.20 Multi-Agent",
      "description": "Grok 4.20 multi-agent model"
    }
  ]
}
