{
  "schema_version": 1,
  "provider_id": "openai",
  "access_profile": "api",
  "source": "curated",
  "observed_at": null,
  "completeness": "partial",
  "models": [
    {
      "id": "gpt-6-astra",
      "name": "GPT-6 Astra",
      "description": "OpenAI's GPT-6 flagship in Codex (efforts low..ultra). Default."
    },
    {
      "id": "gpt-5.6",
      "name": "GPT-5.6",
      "description": "Alias for GPT-5.6 Sol, OpenAI's flagship reasoning and coding model"
    },
    {
      "id": "gpt-5.6-sol",
      "name": "GPT-5.6 Sol",
      "description": "Flagship GPT-5.6 model for complex reasoning and coding"
    },
    {
      "id": "gpt-daybreak-blue-latest",
      "name": "Daybreak Blue",
      "description": "Frontier model for approved defensive cybersecurity work; requires Daybreak access"
    },
    {
      "id": "gpt-5.6-terra",
      "name": "GPT-5.6 Terra",
      "description": "Preview GPT-5.6 model with lower cost than Sol"
    },
    {
      "id": "gpt-5.6-luna",
      "name": "GPT-5.6 Luna",
      "description": "Preview GPT-5.6 model optimized for speed and cost"
    },
    {
      "id": "gpt-5.5",
      "name": "GPT-5.5",
      "description": "Latest frontier coding model in Codex (Spud, 2026-04)"
    },
    {
      "id": "gpt-5.5-pro",
      "name": "GPT-5.5 Pro",
      "description": "Highest-capability GPT-5.5 model"
    },
    {
      "id": "gpt-5.5-codex",
      "name": "GPT-5.5 Codex",
      "description": "Latest Codex-optimized coding model"
    },
    {
      "id": "gpt-5.4",
      "name": "GPT-5.4",
      "description": "Previous frontier coding model in Codex"
    },
    {
      "id": "gpt-5.4-pro",
      "name": "GPT-5.4 Pro",
      "description": "Highest-capability GPT-5.4 model"
    },
    {
      "id": "gpt-5.4-mini",
      "name": "GPT-5.4 Mini",
      "description": "Smaller, lower-latency GPT-5.4 model"
    },
    {
      "id": "gpt-5.4-nano",
      "name": "GPT-5.4 Nano",
      "description": "Smallest, lowest-cost GPT-5.4 model"
    },
    {
      "id": "gpt-5.3-codex",
      "name": "GPT-5.3 Codex",
      "description": "Codex-specialized model"
    }
  ]
}
