{
  "schema_version": 1,
  "provider_id": "minimax",
  "access_profile": "api",
  "source": "curated",
  "observed_at": null,
  "completeness": "partial",
  "models": [
    {
      "id": "MiniMax-M3",
      "name": "MiniMax M3",
      "description": "Latest MiniMax coding and agentic model with 1M context"
    },
    {
      "id": "MiniMax-M2.7",
      "name": "MiniMax M2.7",
      "description": "Previous flagship MiniMax model"
    },
    {
      "id": "MiniMax-M2.5",
      "name": "MiniMax M2.5",
      "description": "Previous flagship MiniMax model"
    },
    {
      "id": "MiniMax-M2.5-highspeed",
      "name": "MiniMax M2.5 Highspeed",
      "description": "Fast variant of M2.5"
    },
    {
      "id": "MiniMax-M2.1",
      "name": "MiniMax M2.1",
      "description": "Balanced capability and speed"
    },
    {
      "id": "MiniMax-M2",
      "name": "MiniMax M2",
      "description": "Fast and economical"
    }
  ]
}
