{
  "schema_version": 1,
  "provider_id": "open-router",
  "access_profile": "api",
  "source": "curated",
  "observed_at": null,
  "completeness": "partial",
  "models": [
    {
      "id": "anthropic/claude-opus-5.5",
      "name": "Claude Opus 5.5",
      "description": "Anthropic Claude via OpenRouter"
    },
    {
      "id": "anthropic/claude-opus-5",
      "name": "Claude Opus 5",
      "description": "Anthropic Claude via OpenRouter"
    },
    {
      "id": "anthropic/claude-sonnet-4.6",
      "name": "Claude Sonnet 4.6",
      "description": "Anthropic Claude via OpenRouter"
    },
    {
      "id": "google/gemini-3.1-pro-preview",
      "name": "Gemini 3.1 Pro Preview",
      "description": "Google Gemini via OpenRouter"
    },
    {
      "id": "openai/gpt-5.6",
      "name": "GPT-5.6",
      "description": "OpenAI GPT via OpenRouter"
    },
    {
      "id": "meta-llama/llama-3.3-70b-instruct:free",
      "name": "Llama 3.3 70B Instruct (free)",
      "description": "Meta Llama via OpenRouter"
    }
  ]
}
