{
  "schema_version": 1,
  "provider_id": "google",
  "access_profile": "api",
  "source": "curated",
  "observed_at": null,
  "completeness": "partial",
  "models": [
    {
      "id": "gemini-3.1-pro-preview",
      "name": "Gemini 3.1 Pro Preview",
      "description": "Advanced reasoning with three-tier thinking"
    },
    {
      "id": "gemini-3-pro-preview",
      "name": "Gemini 3 Pro Preview",
      "description": "State-of-the-art reasoning and multimodal"
    },
    {
      "id": "gemini-3-flash-preview",
      "name": "Gemini 3 Flash Preview",
      "description": "Fast frontier-class performance"
    },
    {
      "id": "gemini-2.5-pro",
      "name": "Gemini 2.5 Pro",
      "description": "Advanced reasoning and long context"
    },
    {
      "id": "gemini-2.5-flash",
      "name": "Gemini 2.5 Flash",
      "description": "Fast and efficient with thinking"
    }
  ]
}
